{
  "id": "bd-update-001",
  "programAreaId": "video-production",
  "title": "Broadcast Desk Update 001: Production Check-In",
  "status": "draft",
  "audience": [
    "students"
  ],
  "summary": "Students review a teacher-created production check-in and submit the required response or media evidence.",
  "studentInstructions": "Read the update, confirm what production evidence is required, and submit the requested response, link, file, or notes.",
  "linkedResources": [],
  "relatedProjectIds": [
    "vp-p01"
  ],
  "submissionRequirements": [
    "Media file, link, or production response",
    "Short reflection or production notes"
  ],
  "teacherNotes": "Replace this draft with the current production check-in, real classroom instructions, and teacher-approved resource links before use.",
  "publishDate": "",
  "dueDate": "",
  "tags": [
    "broadcast-desk",
    "video-production",
    "pilot"
  ]
}
