{
  "id": "bd-update-002",
  "programAreaId": "video-production",
  "title": "Broadcast Desk Update 002: B-Roll Collection",
  "status": "draft",
  "audience": [
    "students"
  ],
  "summary": "Students review B-roll collection expectations and submit evidence for the B-Roll Sequence pilot project.",
  "studentInstructions": "Review the B-roll collection checklist, capture or organize the required shots, and submit the finished evidence or link.",
  "linkedResources": [],
  "relatedProjectIds": [
    "vp-p02"
  ],
  "submissionRequirements": [
    "B-roll sequence file or hosted link",
    "Shot list or production notes",
    "Short reflection"
  ],
  "teacherNotes": "Use this update to test how Broadcast Desk posts can point students into a specific video production project and submission workflow.",
  "publishDate": "",
  "dueDate": "",
  "tags": [
    "broadcast-desk",
    "video-production",
    "pilot"
  ]
}
